{
  "$schema": "./theme.schema.json",
  "schemaVersion": 1,
  "name": "github-dark",
  "kind": "dark",
  "colors": {
    "background": "#0d1117",
    "surface": "#161b22",
    "text": "#c9d1d9",
    "muted": "#8b949e",
    "border": "#30363d",
    "accent": "#58a6ff",
    "accent-fg": "#0d1117",
    "link": "#58a6ff",
    "code-bg": "#161b22",
    "code-fg": "#c9d1d9",
    "quote": "#8b949e"
  },
  "shiki": {
    "light": "github-dark",
    "dark": "github-dark"
  },
  "mermaid": {
    "theme": "dark",
    "overrides": {
      "activationBkgColor": "hsl(180, 1.5873015873%, 28.3529411765%)",
      "activationBorderColor": "#ccc",
      "activeTaskBkgColor": "#81B1DB",
      "activeTaskBorderColor": "#ffffff",
      "actorBkg": "#1f2020",
      "actorBorder": "#ccc",
      "actorLineColor": "#ccc",
      "actorTextColor": "lightgrey",
      "altBackground": "#555",
      "altSectionBkgColor": "#333",
      "archEdgeArrowColor": "lightgrey",
      "archEdgeColor": "lightgrey",
      "archEdgeWidth": "3",
      "archGroupBorderColor": "#cccccc",
      "archGroupBorderWidth": "2px",
      "arrowheadColor": "lightgrey",
      "attributeBackgroundColorEven": "hsl(0, 0%, 22%)",
      "attributeBackgroundColorOdd": "hsl(0, 0%, 32%)",
      "background": "#333",
      "border1": "#ccc",
      "border2": "rgba(255, 255, 255, 0.25)",
      "cScale0": "#1f2020",
      "cScale1": "#0b0000",
      "cScale10": "#00296f",
      "cScale11": "#01629c",
      "cScale12": "#010029",
      "cScale2": "#4d1037",
      "cScale3": "#3f5258",
      "cScale4": "#4f2f1b",
      "cScale5": "#6e0a0a",
      "cScale6": "#3b0048",
      "cScale7": "#995a01",
      "cScale8": "#154706",
      "cScale9": "#161722",
      "cScaleInv0": "#e0dfdf",
      "cScaleInv1": "#f4ffff",
      "cScaleInv10": "#ffd690",
      "cScaleInv11": "#fe9d63",
      "cScaleInv2": "#b2efc8",
      "cScaleInv3": "#c0ada7",
      "cScaleInv4": "#b0d0e4",
      "cScaleInv5": "#91f5f5",
      "cScaleInv6": "#c4ffb7",
      "cScaleInv7": "#66a5fe",
      "cScaleInv8": "#eab8f9",
      "cScaleInv9": "#e9e8dd",
      "cScaleLabel0": "lightgrey",
      "cScaleLabel1": "lightgrey",
      "cScaleLabel10": "lightgrey",
      "cScaleLabel11": "lightgrey",
      "cScaleLabel2": "lightgrey",
      "cScaleLabel3": "lightgrey",
      "cScaleLabel4": "lightgrey",
      "cScaleLabel5": "lightgrey",
      "cScaleLabel6": "lightgrey",
      "cScaleLabel7": "lightgrey",
      "cScaleLabel8": "lightgrey",
      "cScaleLabel9": "lightgrey",
      "cScalePeer0": "hsl(180, 1.5873015873%, 22.3529411765%)",
      "cScalePeer1": "hsl(0, 100%, 12.1568627451%)",
      "cScalePeer10": "hsl(217.8378378378, 100%, 31.7647058824%)",
      "cScalePeer11": "hsl(202.4516129032, 98.7261146497%, 40.7843137255%)",
      "cScalePeer2": "hsl(321.6393442623, 65.5913978495%, 28.2352941176%)",
      "cScalePeer3": "hsl(194.4, 16.5562913907%, 39.6078431373%)",
      "cScalePeer4": "hsl(23.0769230769, 49.0566037736%, 30.7843137255%)",
      "cScalePeer5": "hsl(0, 83.3333333333%, 33.5294117647%)",
      "cScalePeer6": "hsl(289.1666666667, 100%, 24.1176470588%)",
      "cScalePeer7": "hsl(35.1315789474, 98.7012987013%, 40.1960784314%)",
      "cScalePeer8": "hsl(106.1538461538, 84.4155844156%, 25.0980392157%)",
      "cScalePeer9": "hsl(235, 21.4285714286%, 20.9803921569%)",
      "classText": "#e0dfdf",
      "clusterBkg": "hsl(180, 1.5873015873%, 28.3529411765%)",
      "clusterBorder": "rgba(255, 255, 255, 0.25)",
      "commitLabelBackground": "hsl(180, 1.5873015873%, 28.3529411765%)",
      "commitLabelColor": "rgb(183.8476190475, 181.5523809523, 181.5523809523)",
      "commitLabelFontSize": "10px",
      "compositeBackground": "#333",
      "compositeBorder": "#ccc",
      "compositeTitleBackground": "#1f2020",
      "critBkgColor": "#E83737",
      "critBorderColor": "#E83737",
      "darkTextColor": "hsl(28.5714285714, 17.3553719008%, 86.2745098039%)",
      "defaultLinkColor": "lightgrey",
      "doneTaskBkgColor": "lightgrey",
      "doneTaskBorderColor": "grey",
      "dropShadow": "drop-shadow( 1px 2px 2px rgba(185,185,185,1))",
      "edgeLabelBackground": "hsl(0, 0%, 34.4117647059%)",
      "emArrowhead": "lightgrey",
      "emCommandFill": "hsl(218.6666666667, 33.3333333333%, 36.4705882353%)",
      "emCommandStroke": "#5c6d8c",
      "emEventFill": "hsl(32, 33.3333333333%, 36.4705882353%)",
      "emEventStroke": "#8c755c",
      "emProcessorFill": "hsl(296.1290322581, 20.2614379085%, 40%)",
      "emProcessorStroke": "#8a6d8c",
      "emReadModelFill": "hsl(98.6666666667, 33.3333333333%, 36.4705882353%)",
      "emReadModelStroke": "#6d8c5c",
      "emRelationStroke": "lightgrey",
      "emSwimlaneBackgroundOdd": "hsl(0, 0%, 25%)",
      "emSwimlaneBackgroundStroke": "hsl(0, 0%, 32%)",
      "emUiFill": "#2d2d2d",
      "emUiStroke": "#555",
      "errorBkgColor": "#a44141",
      "errorTextColor": "#ddd",
      "excludeBkgColor": "hsl(52.9411764706, 28.813559322%, 48.431372549%)",
      "fillType0": "#1f2020",
      "fillType1": "hsl(180, 1.5873015873%, 28.3529411765%)",
      "fillType2": "hsl(244, 1.5873015873%, 12.3529411765%)",
      "fillType3": "hsl(244, 1.5873015873%, 28.3529411765%)",
      "fillType4": "hsl(116, 1.5873015873%, 12.3529411765%)",
      "fillType5": "hsl(116, 1.5873015873%, 28.3529411765%)",
      "fillType6": "hsl(308, 1.5873015873%, 12.3529411765%)",
      "fillType7": "hsl(308, 1.5873015873%, 28.3529411765%)",
      "flowContainerStroke": "hsl(180, 0%, 18.3529411765%)",
      "fontFamily": "\"trebuchet ms\", verdana, arial, sans-serif",
      "fontSize": "16px",
      "fontWeight": "normal",
      "git0": "hsl(180, 1.5873015873%, 48.3529411765%)",
      "git1": "hsl(321.6393442623, 65.5913978495%, 38.2352941176%)",
      "git2": "hsl(194.4, 16.5562913907%, 49.6078431373%)",
      "git3": "hsl(23.0769230769, 49.0566037736%, 40.7843137255%)",
      "git4": "hsl(0, 83.3333333333%, 43.5294117647%)",
      "git5": "hsl(289.1666666667, 100%, 24.1176470588%)",
      "git6": "hsl(35.1315789474, 98.7012987013%, 40.1960784314%)",
      "git7": "hsl(106.1538461538, 84.4155844156%, 35.0980392157%)",
      "gitBranchLabel0": "#2c2c2c",
      "gitBranchLabel1": "lightgrey",
      "gitBranchLabel2": "lightgrey",
      "gitBranchLabel3": "#2c2c2c",
      "gitBranchLabel4": "lightgrey",
      "gitBranchLabel5": "lightgrey",
      "gitBranchLabel6": "lightgrey",
      "gitBranchLabel7": "lightgrey",
      "gitInv0": "rgb(133.6571428571, 129.7428571428, 129.7428571428)",
      "gitInv1": "rgb(93.5483870969, 221.4516129033, 139.677419355)",
      "gitInv2": "rgb(149.4437086091, 117.6092715231, 107.5562913906)",
      "gitInv3": "rgb(99.9811320754, 162.7735849057, 202.0188679245)",
      "gitInv4": "rgb(51.5000000001, 236.5, 236.5)",
      "gitInv5": "rgb(154.2083333334, 255, 132.0000000001)",
      "gitInv6": "rgb(51.331168831, 135.1948051946, 253.6688311688)",
      "gitInv7": "rgb(206.1818181817, 89.948051948, 241.051948052)",
      "gradientStart": "#cccccc",
      "gradientStop": "hsl(180, 0%, 18.3529411765%)",
      "gridColor": "lightgrey",
      "innerEndBackground": "#cccccc",
      "labelBackground": "#181818",
      "labelBackgroundColor": "#1f2020",
      "labelBoxBkgColor": "#1f2020",
      "labelBoxBorderColor": "#ccc",
      "labelColor": "calculated",
      "labelTextColor": "lightgrey",
      "lineColor": "lightgrey",
      "loopTextColor": "lightgrey",
      "mainBkg": "#1f2020",
      "mainContrastColor": "lightgrey",
      "nodeBkg": "#1f2020",
      "nodeBorder": "#ccc",
      "noteBkgColor": "hsl(180, 1.5873015873%, 28.3529411765%)",
      "noteBorderColor": "hsl(180, 0%, 18.3529411765%)",
      "noteFontWeight": "normal",
      "noteTextColor": "rgb(183.8476190475, 181.5523809523, 181.5523809523)",
      "personBkg": "#1f2020",
      "personBorder": "#cccccc",
      "pie0": "#1f2020",
      "pie1": "#0b0000",
      "pie10": "#00296f",
      "pie11": "#01629c",
      "pie2": "#4d1037",
      "pie3": "#3f5258",
      "pie4": "#4f2f1b",
      "pie5": "#6e0a0a",
      "pie6": "#3b0048",
      "pie7": "#995a01",
      "pie8": "#154706",
      "pie9": "#161722",
      "pieLegendTextColor": "lightgrey",
      "pieLegendTextSize": "17px",
      "pieOpacity": "0.7",
      "pieOuterStrokeColor": "black",
      "pieOuterStrokeWidth": "2px",
      "pieSectionTextColor": "#ccc",
      "pieSectionTextSize": "17px",
      "pieStrokeColor": "black",
      "pieStrokeWidth": "2px",
      "pieTitleTextColor": "lightgrey",
      "pieTitleTextSize": "25px",
      "primaryBorderColor": "#cccccc",
      "primaryColor": "#1f2020",
      "primaryTextColor": "#e0dfdf",
      "quadrant1Fill": "#1f2020",
      "quadrant1TextFill": "#e0dfdf",
      "quadrant2Fill": "#242525",
      "quadrant2TextFill": "#dbdada",
      "quadrant3Fill": "#292a2a",
      "quadrant3TextFill": "#d6d5d5",
      "quadrant4Fill": "#2e2f2f",
      "quadrant4TextFill": "#d1d0d0",
      "quadrantExternalBorderStrokeFill": "#cccccc",
      "quadrantInternalBorderStrokeFill": "#cccccc",
      "quadrantPointFill": "hsl(180, 1.5873015873%, NaN%)",
      "quadrantPointTextFill": "#e0dfdf",
      "quadrantTitleFill": "#e0dfdf",
      "quadrantXAxisTextFill": "#e0dfdf",
      "quadrantYAxisTextFill": "#e0dfdf",
      "rectBkgColor": "hsl(20, 1.5873015873%, 12.3529411765%)",
      "relationColor": "lightgrey",
      "relationLabelBackground": "hsl(180, 1.5873015873%, 28.3529411765%)",
      "relationLabelColor": "lightgrey",
      "requirementBackground": "#1f2020",
      "requirementBorderColor": "#cccccc",
      "requirementBorderSize": "1",
      "requirementTextColor": "#e0dfdf",
      "rowEven": "hsl(180, 1.5873015873%, 2.3529411765%)",
      "rowOdd": "hsl(180, 1.5873015873%, 17.3529411765%)",
      "scaleLabelColor": "lightgrey",
      "secondBkg": "hsl(180, 1.5873015873%, 28.3529411765%)",
      "secondaryBorderColor": "hsl(180, 0%, 18.3529411765%)",
      "secondaryColor": "hsl(180, 1.5873015873%, 28.3529411765%)",